Symbol,Name,Last Sale,Net Change,% Change,Market Cap,Country,IPO Year,Volume,Sector,Industry
PPIH,Perma-Pipe International Holdings Inc. Common Stock,$13.29,-0.22,-1.628%,106088329.00,United States,,4216,Industrials,Pollution Control Equipment
PPSI,Pioneer Power Solutions Inc. Common Stock,$2.68,0.01,0.375%,29802313.00,United States,,10713,Industrials,Electrical Products
PPT,Putnam Premier Income Trust Common Stock,$3.71,0.00,0.00%,369249856.00,United States,1988,216743,Finance,Finance Companies
PPTA,Perpetua Resources Corp. Common Shares,$13.91,0.23,1.681%,991151987.00,Canada,,778215,Basic Materials,Precious Metals
PRA,ProAssurance Corporation Common Stock,$23.19,0.04,0.173%,1189469202.00,United States,,475927,Finance,Property-Casualty Insurers
PRAA,PRA Group Inc. Common Stock,$14.19,0.01,0.071%,561479839.00,United States,2002,450087,Finance,Finance: Consumer Services
PRAX,Praxis Precision Medicines Inc. Common Stock,$38.55,0.10,0.26%,785224256.00,United States,2020,342490,Health Care,Biotechnology: Pharmaceutical Preparations
PRCH,Porch Group Inc. Common Stock,$9.12,-0.31,-3.287%,1108421717.00,United States,2020,4006693,Technology,Computer Software: Prepackaged Software
PRE,Prenetics Global Limited Class A Ordinary Share,$9.30,-0.70,-7.00%,121216023.00,Hong Kong,,51575,Finance,Blank Checks
PRENW,Prenetics Global Limited Warrant,$0.0091,-0.0029,-24.167%,118609.00,Hong Kong,,42039,Finance,Blank Checks
PRFX,PainReform Ltd. Ordinary Shares,$1.93,0.05,2.66%,3638052.00,Israel,2020,32957,Health Care,Biotechnology: Pharmaceutical Preparations
PRG,PROG Holdings Inc. Common Stock,$28.83,-0.27,-0.928%,1163406166.00,United States,,481573,Consumer Discretionary,Diversified Commercial Services
PRLB,Proto Labs Inc. Common stock,$36.98,-0.63,-1.675%,879038267.00,United States,2012,175841,Industrials,Metal Fabrications
PRLD,Prelude Therapeutics Incorporated Common Stock,$0.8859,-0.016,-1.774%,50018340.00,United States,2020,69734,Health Care,Biotechnology: Pharmaceutical Preparations
PRM,Perimeter Solutions SA Common Stock,$12.07,-0.07,-0.577%,1783086194.00,Luxembourg,,1804214,Industrials,Major Chemicals
PRME,Prime Medicine Inc. Common Stock,$1.18,-0.08,-6.349%,154927456.00,United States,2022,1348771,Health Care,Biotechnology: Biological Products (No Diagnostic Substances)
PRO,PROS Holdings Inc. Common Stock,$17.59,-0.42,-2.332%,841724930.00,United States,2007,730604,Technology,EDP Services
PROF,Profound Medical Corp. Common Stock,$5.27,-0.06,-1.126%,158309793.00,Canada,,69937,Health Care,Medical/Dental Instruments
PROK,ProKidney Corp. Class A Ordinary Shares,$0.7228,0.0023,0.319%,211565746.00,United States,2021,393092,Health Care,Biotechnology: Biological Products (No Diagnostic Substances)
PROP,Prairie Operating Co. Common Stock,$3.87,0.22,6.027%,169620927.00,United States,,1049883,Finance,Finance: Consumer Services
PROV,Provident Financial Holdings Inc. Common Stock,$15.42,0.22,1.447%,102098133.00,United States,,2693,Finance,Savings Institutions
PRPH,ProPhase Labs Inc. Common Stock (DE),$0.3695,0.0045,1.233%,15349475.00,United States,,705995,Health Care,Biotechnology: Pharmaceutical Preparations
PRPL,Purple Innovation Inc. Common Stock,$0.7966,-0.0029,-0.363%,86340667.00,United States,2015,308525,Consumer Discretionary,Home Furnishings
PRPO,Precipio Inc.  Common Stock,$9.44,-0.52,-5.221%,14273384.00,United States,,3857,Industrials,Biotechnology: Laboratory Analytical Instruments
PRQR,ProQR Therapeutics N.V. Ordinary Shares,$1.66,-0.08,-4.598%,174652795.00,Netherlands,2014,271509,Health Care,Biotechnology: Pharmaceutical Preparations
PRSO,Peraso Inc. Common Stock,$0.9304,-0.0181,-1.908%,4731749.00,United States,,815842,Technology,Semiconductors
PRSU,Pursuit Attractions and Hospitality Inc. Common Stock,$27.89,-0.86,-2.991%,788056103.00,United States,,449640,Consumer Discretionary,Business Services
PRT,PermRock Royalty Trust Trust Units,$4.02,-0.02,-0.495%,48906243.00,United States,2018,45531,Energy,Oil & Gas Production
PRTA,Prothena Corporation plc Ordinary Shares,$4.59,-0.11,-2.34%,247065847.00,United States,,1963387,Health Care,Biotechnology: Pharmaceutical Preparations
PRTC,PureTech Health plc American Depositary Shares,$18.43,0.07,0.381%,441253474.00,United States,,1153,Health Care,Biotechnology: Pharmaceutical Preparations
PRTG,Portage Biotech Inc. Common Stock,$8.04,-0.08,-0.985%,8430857.00,Canada,,4474,Energy,Oil & Gas Production
PRTH,Priority Technology Holdings Inc. Common Stock,$8.53,0.28,3.394%,680297150.00,United States,2016,637605,Consumer Discretionary,Business Services
PRTS,CarParts.com Inc. Common Stock,$0.8779,-0.0161,-1.801%,51338238.00,United States,2007,175120,Consumer Discretionary,Auto & Home Supply Stores
PRZO,ParaZero Technologies Ltd. Ordinary Shares,$0.8611,-0.0588,-6.392%,14362830.00,Israel,2023,483836,Industrials,Military/Government/Technical
PSBD,Palmer Square Capital BDC Inc. Common Stock,$13.98,0.17,1.231%,0.00,,2024,25575,,
PSEC,Prospect Capital Corporation Common Stock,$3.29,0.05,1.543%,1485549334.00,United States,2004,4574805,Finance,Finance: Consumer Services
PSF,Cohen & Steers Select Preferred and Income Fund Inc. Common Stock,$19.53,-0.01,-0.051%,959677405.00,,2010,39719,Finance,Investment Managers
PSFE,Paysafe Limited Common Shares,$12.35,-0.15,-1.20%,739620554.00,,2021,447072,Consumer Discretionary,Business Services
PSHG,Performance Shipping Inc. Common Shares,$1.74,0.02,1.163%,21631955.00,Greece,,64695,Consumer Discretionary,Marine Transportation
PSIG,PS International Group Ltd. Ordinary Shares,$0.355,-0.025,-6.579%,9221812.00,Hong Kong,,297807,Consumer Discretionary,Oil Refining/Marketing
PSIX,Power Solutions International Inc. Common Stock,$42.37,1.22,2.965%,974858197.00,United States,,213657,Industrials,Industrial Machinery/Components
PSNL,Personalis Inc. Common Stock,$4.63,0.04,0.871%,408945389.00,United States,2019,463346,Health Care,Medical Specialities
PSNYW,Polestar Automotive Holding UK PLC Class C-1 ADS (ADW),$0.1601,0.0001,0.063%,337867767.00,Sweden,,136044,Consumer Discretionary,Auto Manufacturing
PSQH,PSQ Holdings Inc. Class A Common Stock,$2.15,-0.22,-9.283%,97908798.00,,2021,1255192,Consumer Discretionary,Advertising
PSTL,Postal Realty Trust Inc. Class A Common Stock,$13.84,-0.02,-0.144%,329468743.00,United States,2019,139202,Real Estate,Real Estate Investment Trusts
PSTV,PLUS THERAPEUTICS Inc. Common Stock ,$0.2869,0.0005,0.175%,4877193.00,United States,,18974519,Health Care,Medical/Dental Instruments
PT,Pintec Technology Holdings Limited American Depositary Shares,$0.9135,-0.0665,-6.786%,14568461.00,China,2018,46794,Technology,Computer Software: Programming Data Processing
PTA,Cohen & Steers Tax-Advantaged Preferred Securities and Income Fund Common Shares of Beneficial Interest,$19.56,0.06,0.308%,1081148819.00,United States,2020,103305,Finance,Trusts Except Educational Religious and Charitable
PTHL,Pheton Holdings Ltd Class A Ordinary Shares,$6.20,0.23,3.853%,88350000.00,China,2024,132512,Health Care,Biotechnology: Electromedical & Electrotherapeutic Apparatus
PTIX,Protagenic Therapeutics Inc. Common Stock,$3.85,0.04,1.05%,2267508.00,United States,,659595,Health Care,Biotechnology: Pharmaceutical Preparations
PTIXW,Protagenic Therapeutics Inc. Warrant,$0.0717,-0.0171,-19.257%,42229.00,United States,,41941,Health Care,Biotechnology: Pharmaceutical Preparations
PTLE,PTL LTD Ordinary Shares,$1.41,-0.02,-1.399%,52857375.00,Singapore,2024,4925260,Energy,Oil Refining/Marketing
PTLO,Portillo's Inc. Class A Common Stock,$12.00,0.09,0.756%,897783948.00,United States,2021,2009702,Consumer Discretionary,Restaurants
PTMN,Portman Ridge Finance Corporation Common Stock,$12.10,0.02,0.166%,111354727.00,United States,2006,40841,Finance,Finance: Consumer Services
PTNM,Pitanium Limited Class A Ordinary shares,$3.80,-0.20,-5.00%,0.00,Hong Kong,,5683860,,
PTY,Pimco Corporate & Income Opportunity Fund,$13.75,0.04,0.292%,0.00,United States,2002,469350,Finance,Investment Managers
PUBM,PubMatic Inc. Class A Common Stock,$11.70,-0.13,-1.099%,567843693.00,United States,2020,645353,Technology,Computer Software: Programming Data Processing
PULM,Pulmatrix Inc. Common Stock,$8.98,0.78,9.512%,32797519.00,United States,2014,33150,Health Care,Biotechnology: Pharmaceutical Preparations
PUMP,ProPetro Holding Corp. Common Stock,$5.40,-0.15,-2.703%,561112985.00,United States,2017,943176,Energy,Oilfield Services/Equipment
PVBC,Provident Bancorp Inc. (MD) Common Stock,$11.39,-0.01,-0.088%,202605753.00,United States,2015,50947,Finance,Banks
PVL,Permianville Royalty Trust Trust Units ,$1.62,-0.01,-0.613%,53460000.00,United States,2011,52977,Energy,Oil & Gas Production
PVLA,Palvella Therapeutics Inc. Common Stock,$24.13,-0.65,-2.623%,266773196.00,United States,,83965,Health Care,Biotechnology: Pharmaceutical Preparations
PW,Power REIT (MD) Common Stock,$1.089,-0.0009,-0.083%,3691341.00,United States,1998,10353,Real Estate,Real Estate Investment Trusts
PWM,Prestige Wealth Inc. Class A Ordinary Shares,$0.409,0.019,4.872%,12941561.00,Hong Kong,2023,24677,Finance,Finance: Consumer Services
PWOD,Penns Woods Bancorp Inc. Common Stock,$29.59,0.03,0.101%,225304592.00,United States,,10695,Finance,Major Banks
PWP,Perella Weinberg Partners Class A Common Stock,$17.37,-0.42,-2.361%,1535215680.00,United States,2020,803821,Finance,Finance: Consumer Services
PX,P10 Inc. Class A Common Stock,$10.86,0.02,0.185%,1217671809.00,United States,2021,869522,Finance,Investment Managers
PXLW,Pixelworks Inc.  Common Stock,$0.4861,-0.0139,-2.78%,30601252.00,United States,2000,94434,Technology,Semiconductors
PXS,Pyxis Tankers Inc. Common Stock,$2.89,0.01,0.347%,30304150.00,Greece,,39492,Consumer Discretionary,Marine Transportation
PXSAW,Pyxis Tankers Inc. Warrant,$0.037,-0.0004,-1.07%,387977.00,Greece,,13267,Consumer Discretionary,Marine Transportation
PYN,PIMCO New York Municipal Income Fund III Common Shares of Beneficial Interest,$5.295,0.005,0.095%,0.00,United States,2002,2730,Finance,Investment Managers
PYPD,PolyPid Ltd. Ordinary Shares,$2.80,0.01,0.358%,28534531.00,Israel,2020,53793,Health Care,Biotechnology: Pharmaceutical Preparations
PYXS,Pyxis Oncology Inc. Common Stock,$1.21,-0.04,-3.20%,74956675.00,United States,2021,210506,Health Care,Biotechnology: Pharmaceutical Preparations
PZC,PIMCO California Municipal Income Fund III Common Shares of Beneficial Interest,$6.19,-0.03,-0.482%,0.00,United States,2002,74522,Finance,Investment Managers
PZG,Paramount Gold Nevada Corp. Common Stock,$0.5541,-0.0049,-0.877%,39589974.00,United States,2015,100750,Basic Materials,Metal Mining
PZZA,Papa John's International Inc. Common Stock,$45.25,1.43,3.263%,1481414184.00,United States,1993,921577,Consumer Discretionary,Restaurants
QCRH,QCR Holdings Inc. Common Stock,$67.30,-0.58,-0.854%,1139484431.00,United States,,83614,Finance,Major Banks
QD,Qudian Inc. American Depositary Shares each representing one Class A Ordinary Share,$2.96,0.00,0.00%,488774416.00,China,2017,181303,Finance,Finance: Consumer Services
QETAR,Quetta Acquisition Corporation Right,$1.41,0.00,0.00%,0.00,United States,2023,100,Finance,Blank Checks
QH,Quhuo Limited American Depository Shares,$1.22,0.01,0.826%,109427917.00,China,2020,5184,Consumer Discretionary,Business Services
QIPT,Quipt Home Medical Corp. Common Shares,$1.79,0.02,1.13%,77133379.00,United States,,606721,Health Care,Misc Health and Biotechnology Services
QLGN,Qualigen Therapeutics Inc. Common Stock,$3.77,-0.03,-0.789%,2776345.00,United States,2015,2134,Health Care,Biotechnology: Pharmaceutical Preparations
QMCO,Quantum Corporation Common Stock,$11.87,-0.63,-5.04%,69251942.00,United States,,2020623,Technology,Electronic Components
QMMM,QMMM Holdings Limited Class A Ordinary Shares,$1.07,-0.23,-17.692%,18410786.00,Hong Kong,2024,811861,Consumer Discretionary,Advertising
QNCX,Quince Therapeutics Inc. Common Stock,$1.04,0.00,0.00%,47287533.00,United States,2019,102293,Health Care,Biotechnology: Biological Products (No Diagnostic Substances)
QNRX,Quoin Pharmaceuticals Ltd. American Depositary Shares,$8.53,-0.54,-5.954%,5017056.00,Israel,2016,22059,Health Care,Medical/Dental Instruments
QNST,QuinStreet Inc. Common Stock,$15.27,-0.31,-1.99%,869655895.00,United States,2010,586731,Consumer Discretionary,Business Services
QNTM,Quantum Biopharma Ltd. Class B Subordinate Voting Shares,$13.46,0.88,6.995%,39454612.00,Canada,,439592,Health Care,Biotechnology: Pharmaceutical Preparations
QQQX,Nuveen NASDAQ 100 Dynamic Overwrite Fund Shares of Beneficial Interest,$25.24,0.07,0.278%,0.00,United States,,145588,Finance,Finance Companies
QRHC,Quest Resource Holding Corporation Common Stock,$2.20,-0.02,-0.901%,45400425.00,United States,,53658,Utilities,Environmental Services
QSEA,Quartzsea Acquisition Corporation Ordinary Shares,$10.00,0.00,0.00%,0.00,United States,2025,26,Finance,Blank Checks
QSEAR,Quartzsea Acquisition Corporation Rights,$0.25,-0.005,-1.961%,0.00,United States,2025,9404,Finance,Blank Checks
QSEAU,Quartzsea Acquisition Corporation Units,$10.24,0.00,0.00%,0.00,United States,2025,10,Finance,Blank Checks
QSG,QuantaSing Group Limited American Depositary Shares,$6.20,0.00,0.00%,316900619.00,China,2023,330725,Real Estate,Other Consumer Services
QSI,Quantum-Si Incorporated Class A Common Stock,$1.68,-0.03,-1.754%,308276835.00,United States,2020,7568171,Industrials,Industrial Machinery/Components
QSIAW,Quantum-Si Incorporated Warrant,$0.80,-0.08,-9.091%,146798493.00,United States,2020,19179,Industrials,Industrial Machinery/Components
QTRX,Quanterix Corporation Common Stock,$5.20,-0.035,-0.669%,201912807.00,United States,2017,481543,Industrials,Biotechnology: Laboratory Analytical Instruments
QTTB,Q32 Bio Inc. Common Stock,$1.73,-0.16,-8.466%,21101874.00,United States,2018,74788,Health Care,Biotechnology: Pharmaceutical Preparations
QUAD,Quad Graphics Inc Class A Common Stock,$5.83,-0.11,-1.852%,295070892.00,United States,,226151,Consumer Discretionary,Publishing
QUBT,Quantum Computing Inc. Common Stock,$11.325,-1.105,-8.89%,1595732545.00,United States,,25616189,Technology,Computer Software: Prepackaged Software
QUIK,QuickLogic Corporation Common Stock,$5.18,0.02,0.388%,82030786.00,United States,1999,111014,Technology,Semiconductors
QURE,uniQure N.V. Ordinary Shares,$14.47,-0.43,-2.886%,792210737.00,Netherlands,2014,1712177,Health Care,Biotechnology: Pharmaceutical Preparations
QVCC,QVC Inc. 6.250% Senior Secured Notes due 2068,$8.00,-0.83,-9.40%,0.00,United States,2019,90525,Consumer Discretionary,Catalog/Specialty Distribution
QVCD,QVC Inc. 6.375% Senior Secured Notes due 2067,$7.91,-0.77,-8.871%,0.00,United States,2018,68476,Consumer Discretionary,Catalog/Specialty Distribution
QVCGA,QVC Group Inc. Series A Common Stock,$4.10,-0.61,-12.951%,33081793.00,United States,,130571,Consumer Discretionary,Catalog/Specialty Distribution
QVCGP,QVC Group Inc. 8.0% Fixed Rate Cumulative Redeemable Preferred Stock,$5.66,-0.54,-8.71%,45669012.00,United States,,195120,Consumer Discretionary,Catalog/Specialty Distribution
RA,Brookfield Real Assets Income Fund Inc. Common Stock,$12.94,0.02,0.155%,0.00,United States,2016,90169,Finance,Investment Managers
RAAQU,Real Asset Acquisition Corp. Unit,$10.12,0.05,0.497%,0.00,United States,2025,271655,Finance,Blank Checks
RAC,Rithm Acquisition Corp. Class A Ordinary Shares,$10.03,-0.01,-0.10%,0.00,,2025,412,,
RAIL,FreightCar America Inc. Common Stock,$7.91,-0.08,-1.001%,150608852.00,United States,2005,173167,Industrials,Railroads
RAIN,Rain Enhancement Technologies Holdco Inc. Class A Common Stock,$3.604,-0.106,-2.857%,27341793.00,United States,,3347,Technology,Industrial Machinery/Components
RAINW,Rain Enhancement Technologies Holdco Inc. Warrants,$0.143,-0.038,-20.994%,1084871.00,United States,,1851,Technology,Industrial Machinery/Components
RAND,Rand Capital Corporation Common Stock,$16.25,0.01,0.062%,48259478.00,United States,,5952,Finance,Finance: Consumer Services
RANG,Range Capital Acquisition Corp. Ordinary Shares,$10.14,0.02,0.198%,0.00,United States,2025,52781,,
RANGU,Range Capital Acquisition Corp. Units,$10.34,0.01,0.097%,0.00,United States,2024,6003,,
RANI,Rani Therapeutics Holdings Inc. Class A Common Stock,$0.5592,-0.02,-3.453%,32177545.00,United States,2021,135940,Health Care,Biotechnology: Pharmaceutical Preparations
RAPP,Rapport Therapeutics Inc. Common Stock,$8.27,-0.24,-2.82%,301834780.00,United States,2024,417110,Health Care,Biotechnology: Pharmaceutical Preparations
RAPT,RAPT Therapeutics Inc. Common Stock,$0.8853,-0.045,-4.837%,117115174.00,United States,2019,338178,Health Care,Biotechnology: Pharmaceutical Preparations
RAVE,Rave Restaurant Group Inc. Common Stock,$2.76,0.10,3.759%,39223922.00,United States,,21339,Consumer Discretionary,Food Distributors
RAY,Raytech Holding Limited Ordinary Shares,$2.65,-0.27,-9.247%,46674670.00,Hong Kong,2024,192470,Consumer Discretionary,Consumer Electronics/Appliances
RAYA,Erayak Power Solution Group Inc. Class A Ordinary Shares,$1.41,-0.0402,-2.772%,71329411.00,China,2022,12981,Consumer Discretionary,Metal Fabrications
RBB,RBB Bancorp Common Stock,$16.98,0.56,3.41%,301222806.00,United States,2017,41844,Finance,Major Banks
RBBN,Ribbon Communications Inc. Common Stock,$3.38,-0.12,-3.429%,596720025.00,United States,,724802,Technology,EDP Services
RBCAA,Republic Bancorp Inc. Class A Common Stock,$68.54,-0.97,-1.395%,1338231506.00,United States,1998,27570,Finance,Major Banks
RBKB,Rhinebeck Bancorp Inc. Common Stock,$11.58,-0.1332,-1.137%,128519518.00,United States,2019,10687,Finance,Banks
RBNE,Robin Energy Ltd. Common Stock,$2.74,-0.0324,-1.169%,6539646.00,Cyprus,,7815,Consumer Discretionary,Marine Transportation
RBOT,Vicarious Surgical Inc. Class A Common Stock,$7.54,-0.21,-2.71%,44727159.00,Hong Kong,2020,3739,Health Care,Industrial Specialties
RC,Ready Capital Corporation Common Stock,$4.47,-0.01,-0.223%,762167305.00,United States,2013,2826710,Real Estate,Real Estate Investment Trusts
RCAT,Red Cat Holdings Inc. Common Stock,$5.95,-0.04,-0.668%,540945827.00,United States,,2952960,Technology,Computer Software: Prepackaged Software
RCD,Ready Capital Corporation 9.00% Senior Notes due 2029,$22.91,-0.79,-3.333%,0.00,United States,2024,43259,Real Estate,Real Estate Investment Trusts
RCEL,Avita Medical Inc. Common Stock,$5.62,-0.15,-2.60%,148562778.00,United States,,455324,Health Care,Medical/Dental Instruments
RCG,RENN Fund Inc Common Stock,$2.625,-0.025,-0.943%,0.00,United States,,12006,Finance,Investment Managers
RCKT,Rocket Pharmaceuticals Inc. Common Stock,$2.51,-0.11,-4.198%,270422177.00,United States,2015,7403795,Health Care,Biotechnology: Pharmaceutical Preparations
RCKTW,Rocket Pharmaceuticals Inc. Warrant,$0.031,0.0025,8.772%,3339875.00,United States,,1466,Health Care,Biotechnology: Pharmaceutical Preparations
RCKY,Rocky Brands Inc. Common Stock,$22.75,0.03,0.132%,169741549.00,United States,1993,77683,Consumer Discretionary,Shoe Manufacturing
RCMT,RCM Technologies Inc. Common Stock,$22.89,0.03,0.131%,169165913.00,United States,,38414,Consumer Discretionary,Professional Services
RCON,Recon Technology Ltd. Class A Ordinary Shares,$2.075,-0.2774,-11.792%,31307515.00,China,2009,982,Energy,Oilfield Services/Equipment
RCS,PIMCO Strategic Income Fund Inc.,$6.42,0.07,1.102%,0.00,United States,1994,80520,Finance,Investment Managers
RCT,RedCloud Holdings plc Ordinary Shares,$1.73,-0.02,-1.143%,76512079.00,United Kingdom,2025,14289,Consumer Discretionary,Other Specialty Stores
RCUS,Arcus Biosciences Inc. Common Stock,$8.93,-0.58,-6.099%,945554282.00,United States,2018,1379584,Health Care,Biotechnology: Pharmaceutical Preparations
RDAC,Rising Dragon Acquisition Corp. Ordinary Shares,$10.27,0.0131,0.128%,0.00,China,2024,12001,,
RDAGU,Republic Digital Acquisition Company Unit,$10.255,-0.015,-0.146%,0.00,United States,2025,126609,Finance,Blank Checks
RDCM,Radcom Ltd. Ordinary Shares,$13.41,0.05,0.374%,213428411.00,Israel,1997,26834,Technology,Computer peripheral equipment
RDFN,Redfin Corporation Common Stock,$9.99,-0.27,-2.632%,1279031478.00,United States,2017,4633015,Finance,Real Estate
RDGT,Ridgetech Inc. Ordinary Shares,$0.961,-0.0273,-2.762%,6394568.00,China,,8140,Consumer Staples,Retail-Drug Stores and Proprietary Stores
RDHL,Redhill Biopharma Ltd. American Depositary Shares,$1.79,0.03,1.705%,4101882.00,Israel,,14796,Health Care,Biotechnology: Pharmaceutical Preparations
RDI,Reading International Inc Class A Common Stock,$1.375,-0.055,-3.846%,30905095.00,United States,,15006,Consumer Discretionary,Movies/Entertainment
RDIB,Reading International Inc Class B Common Stock,$10.55,0.56,5.606%,237126368.00,United States,,5410,Consumer Discretionary,Movies/Entertainment
RDUS,Radius Recycling Inc. Class A Common Stock,$29.61,0.08,0.271%,835060687.00,United States,,1779966,Consumer Discretionary,Industrial Specialties
RDVT,Red Violet Inc. Common Stock ,$48.56,-1.11,-2.235%,677699378.00,United States,,395219,Technology,Computer Software: Prepackaged Software
RDW,Redwire Corporation Common Stock,$14.31,-0.12,-0.832%,1103063340.00,United States,2021,1869341,Industrials,Military/Government/Technical
RDWR,Radware Ltd. Ordinary Shares,$23.32,-0.08,-0.342%,995449973.00,Israel,1999,141351,Consumer Discretionary,Business Services
RDZN,Roadzen Inc. Ordinary Shares,$0.9837,0.0007,0.071%,72981673.00,United States,2022,133207,Finance,Specialty Insurers
RDZNW,Roadzen Inc. Warrants,$0.0434,-0.018,-29.316%,3219889.00,United States,2022,8550,Finance,Specialty Insurers
REAL,The RealReal Inc. Common Stock,$5.65,0.10,1.802%,638988609.00,United States,2019,3520390,Consumer Discretionary,Other Specialty Stores
REAX,The Real Brokerage Inc. Common Shares,$4.12,-0.07,-1.671%,834296065.00,Canada,,526113,Finance,Real Estate
REBN,Reborn Coffee Inc. Common Stock,$2.63,-0.05,-1.866%,13947695.00,United States,2022,29351,Consumer Discretionary,Restaurants
RECT,Rectitude Holdings Ltd Ordinary Shares,$4.67,0.02,0.43%,67715000.00,Singapore,2024,2183,Consumer Discretionary,Industrial Machinery/Components
REE,REE Automotive Ltd. Class A Ordinary Shares,$0.771,-0.0208,-2.627%,23917139.00,Israel,,122413,Consumer Discretionary,Auto Manufacturing
REFI,Chicago Atlantic Real Estate Finance Inc. Common Stock,$14.56,-0.05,-0.342%,305286174.00,United States,2021,57420,Real Estate,Real Estate Investment Trusts
REFR,Research Frontiers Incorporated Common Stock,$1.825,-0.005,-0.273%,61408003.00,United States,,38632,Miscellaneous,Multi-Sector Companies
REI,Ring Energy Inc. Common Stock,$0.7376,-0.0061,-0.82%,152332477.00,United States,,3166927,Energy,Oil & Gas Production
REKR,Rekor Systems Inc. Common Stock,$1.16,0.00,0.00%,136968095.00,United States,,3183025,Telecommunications,Telecommunications Equipment
RELI,Reliance Global Group Inc. Common Stock,$1.35,0.155,12.971%,4016127.00,United States,,154043,Finance,Specialty Insurers
RELIW,Reliance Global Group Inc. Series A Warrants,$0.0259,-0.0047,-15.359%,77050.00,United States,,27976,Finance,Specialty Insurers
RELL,Richardson Electronics Ltd. Common Stock,$8.95,-0.21,-2.293%,128656250.00,United States,1983,26796,Technology,Electronic Components
RENB,Renovaro Inc. Common Stock,$0.3097,-0.0053,-1.683%,53305121.00,United States,,675812,Health Care,Biotechnology: Pharmaceutical Preparations
RENT,Rent the Runway Inc. Class A Common Stock,$5.40,-0.28,-4.93%,21500073.00,United States,2021,61014,Consumer Discretionary,Other Specialty Stores
REPL,Replimune Group Inc. Common Stock,$8.98,-0.39,-4.162%,692239015.00,United States,2018,2181169,Health Care,Biotechnology: Biological Products (No Diagnostic Substances)
REPX,Riley Exploration Permian Inc. Common Stock,$25.66,-0.50,-1.911%,565111104.00,United States,1999,76847,Energy,Oil & Gas Production
RERE,ATRenew Inc. American Depositary Shares (every three of which representing two Class A ordinary shares),$2.58,-0.05,-1.901%,567126149.00,Cayman Islands,2021,463496,Consumer Discretionary,Other Specialty Stores
RES,RPC Inc. Common Stock,$4.44,-0.11,-2.418%,979306407.00,United States,,1171444,Energy,Oilfield Services/Equipment
RETO,ReTo Eco-Solutions Inc. Class A Shares,$3.56,0.10,2.89%,27283409.00,China,2017,7890,Industrials,Industrial Machinery/Components
REVB,Revelation Biosciences Inc. Common Stock,$0.85,-0.03,-3.409%,819227.00,United States,2020,485481,Health Care,Biotechnology: Pharmaceutical Preparations
REVBW,Revelation Biosciences Inc. Warrant,$0.0119,0.0018,17.822%,11469.00,United States,2020,108730,Health Care,Biotechnology: Pharmaceutical Preparations
REVG,REV Group Inc. Common Stock,$37.49,0.21,0.563%,1937301936.00,United States,2017,704752,Consumer Discretionary,Auto Manufacturing
REX,REX American Resources Corporation,$42.14,1.03,2.505%,716918381.00,United States,,140319,Industrials,Major Chemicals
RFAI,RF Acquisition Corp II Ordinary Shares,$10.49,0.00,0.00%,0.00,Singapore,2024,5011,,
RFAIR,RF Acquisition Corp II Right,$0.0752,0.00,0.00%,0.00,Singapore,2024,47,Technology,Computer Software: Prepackaged Software
RFI,Cohen & Steers Total Return Realty Fund Inc. Common Stock,$12.13,0.09,0.748%,596051558.00,United States,1993,96636,Finance,Investment Managers
RFIL,RF Industries Ltd. Common Stock,$4.19,-0.19,-4.338%,44706785.00,United States,,18426,Technology,Electrical Products
RFL,Rafael Holdings Inc. Class B Common Stock,$1.43,0.03,2.143%,45824350.00,United States,2018,74850,Finance,Real Estate
RFM,RiverNorth Flexible Municipal Income Fund Inc. Common Stock,$14.151,-0.009,-0.064%,86529106.00,,2020,14746,Finance,Finance/Investors Services
RFMZ,RiverNorth Flexible Municipal Income Fund II Inc. Common Stock,$12.69,-0.05,-0.392%,309023784.00,,2021,68468,Finance,Trusts Except Educational Religious and Charitable
RGCO,RGC Resources Inc. Common Stock,$20.55,-0.40,-1.909%,211903236.00,United States,,7157,Utilities,Oil & Gas Production
RGLS,Regulus Therapeutics Inc. Common Stock,$7.93,-0.01,-0.126%,549026326.00,United States,2012,1004435,Health Care,Biotechnology: Pharmaceutical Preparations
