Symbol,Name,Last Sale,Net Change,% Change,Market Cap,Country,IPO Year,Volume,Sector,Industry
DBVT,DBV Technologies S.A. American Depositary Shares,$8.35,-0.46,-5.221%,228704613.00,France,2014,47266,Health Care,Biotechnology: Biological Products (No Diagnostic Substances)
DC,Dakota Gold Corp. Common Stock,$3.06,-0.01,-0.326%,342381601.00,United States,2022,262690,Basic Materials,Metal Mining
DCBO,Docebo Inc. Common Shares,$27.32,0.33,1.223%,825908926.00,Canada,,121344,Technology,Computer Software: Prepackaged Software
DCGO,DocGo Inc. Common Stock,$1.42,0.06,4.412%,140728150.00,United States,2020,755543,Health Care,Medical/Nursing Services
DCO,Ducommun Incorporated Common Stock,$70.38,0.52,0.744%,1047095975.00,United States,,83721,Industrials,Military/Government/Technical
DCOM,Dime Community Bancshares Inc. Common Stock,$25.66,-0.08,-0.311%,1124384301.00,United States,,159862,Finance,Major Banks
DCOMG,Dime Community Bancshares Inc. 9.000% Fixed-to-Floating Rate Subordinated Notes due 2034,$26.30,0.003,0.011%,1029609153.00,United States,,1418,Finance,Major Banks
DCOMP,Dime Community Bancshares Inc. Fixed-Rate Non-Cumulative Perpetual Preferred Stock Series A,$17.32,-0.58,-3.24%,758937494.00,United States,,53392,Finance,Major Banks
DCTH,Delcath Systems Inc. Common Stock,$16.21,-0.85,-4.982%,564532426.00,United States,,576064,Health Care,Medical/Dental Instruments
DDC,DDC Enterprise Limited Class A Ordinary Shares,$7.80,1.08,16.071%,621077777.00,,2023,214606,Consumer Staples,Packaged Foods
DDD,3D Systems Corporation Common Stock,$1.55,-0.05,-3.125%,211439942.00,United States,,3808098,Technology,Computer Software: Prepackaged Software
DDI,DoubleDown Interactive Co. Ltd. American Depository Shares,$9.96,-0.02,-0.20%,493552262.00,South Korea,2021,3581,Technology,EDP Services
DDL,Dingdong (Cayman) Limited American Depositary Shares (each two representing three Ordinary Shares),$2.06,-0.07,-3.286%,486629031.00,Cayman Islands,2021,561089,Consumer Discretionary,Catalog/Specialty Distribution
DDT,Dillard's Capital Trust I,$25.98,-0.01,-0.038%,413203171.00,United States,,2816,Consumer Discretionary,Department/Specialty Retail Stores
DEA,Easterly Government Properties Inc. Common Stock,$21.73,-0.29,-1.317%,975789083.00,United States,2015,514010,Real Estate,Real Estate Investment Trusts
DEC,Diversified Energy Company plc Ordinary Shares,$13.97,-0.18,-1.272%,835349310.00,,,445877,,
DEFT,Defi Technologies Inc. Common Stock,$3.58,0.15,4.373%,1170911699.00,Canada,,3049648,Finance,Finance: Consumer Services
DENN,Denny's Corporation Common Stock,$3.82,-0.09,-2.302%,195779072.00,United States,,453776,Consumer Discretionary,Restaurants
DERM,Journey Medical Corporation Common Stock,$8.06,-0.01,-0.124%,187763898.00,United States,2021,57104,Health Care,Biotechnology: Pharmaceutical Preparations
DEVS,DevvStream Corp. Common Stock,$0.4856,-0.0344,-6.615%,14624200.00,Canada,2024,1173744,Finance,Finance/Investors Services
DFDV,DeFi Development Corp. Common Stock,$17.51,-2.15,-10.936%,253317012.00,United States,2023,2802691,Finance,Finance: Consumer Services
DFH,Dream Finders Homes Inc. Class A Common Stock,$20.86,0.01,0.048%,1951536836.00,United States,2022,279581,Consumer Discretionary,Homebuilding
DFIN,Donnelley Financial Solutions Inc. Common Stock ,$54.48,-0.53,-0.963%,1505763894.00,United States,2016,251889,Consumer Discretionary,Other Consumer Services
DFLI,Dragonfly Energy Holdings Corp. Common Stock (NV),$0.4058,0.0434,11.976%,3799564.00,United States,2021,152725,Miscellaneous,Industrial Machinery/Components
DFLIW,Dragonfly Energy Holdings Corp. Warrant,$0.0278,-0.0002,-0.714%,260295.00,United States,2021,620,Miscellaneous,Industrial Machinery/Components
DFP,Flaherty & Crumrine Dynamic Preferred and Income Fund Inc. Common Stock,$20.01,0.03,0.15%,0.00,,2013,79338,Finance,Investment Managers
DGICA,Donegal Group Inc. Class A Common Stock,$20.20,0.03,0.149%,729152754.00,United States,,134177,Finance,Property-Casualty Insurers
DGICB,Donegal Group Inc. Class B Common Stock,$16.80,0.00,0.00%,606424073.00,United States,1986,112,Finance,Property-Casualty Insurers
DGII,Digi International Inc. Common Stock,$32.41,-0.51,-1.549%,1201331682.00,United States,1989,179702,Telecommunications,Computer Communications Equipment
DGLY,Digital Ally Inc. Common Stock,$2.50,-0.02,-0.794%,4171230.00,United States,,506331,Technology,Radio And Television Broadcasting And Communications Equipment
DGNX,Diginex Limited Ordinary Shares,$53.81,-4.40,-7.559%,1248012640.00,Hong Kong,2025,44702,Technology,EDP Services
DGXX,Digi Power X Inc. Subordinate Voting Shares,$1.27,-0.08,-5.926%,46110995.00,Canada,,414950,Finance,Finance: Consumer Services
DH,Definitive Healthcare Corp. Class A Common Stock,$3.31,0.04,1.223%,355301699.00,United States,2021,1286332,Technology,Computer Software: Prepackaged Software
DHAI,DIH Holdings US Inc. Class A Common Stock,$0.2293,-0.0171,-6.94%,10854215.00,United States,2024,449511,Health Care,Medical/Dental Instruments
DHAIW,DIH Holding US Inc. Warrants,$0.0149,-0.0013,-8.025%,705311.00,United States,2024,45958,Health Care,Medical/Dental Instruments
DHC,Diversified Healthcare Trust Common Shares of Beneficial Interest,$3.13,-0.13,-3.988%,755115270.00,United States,,644161,Real Estate,Real Estate Investment Trusts
DHF,BNY Mellon High Yield Strategies Fund Common Stock,$2.51,0.02,0.803%,0.00,United States,1998,189762,Finance,Finance Companies
DHIL,Diamond Hill Investment Group Inc. Class A Common Stock,$141.26,-1.61,-1.127%,385313631.00,United States,,7951,Finance,Investment Managers
DHT,DHT Holdings Inc.,$11.58,0.19,1.668%,1859261385.00,Jersey,2005,1339662,Consumer Discretionary,Marine Transportation
DHX,DHI Group Inc. Common Stock,$2.15,0.08,3.865%,104815121.00,United States,2007,76981,Consumer Discretionary,Business Services
DHY,Credit Suisse High Yield Bond Fund Common Stock,$2.05,0.01,0.49%,0.00,United States,1998,102262,Finance,Finance/Investors Services
DIAX,Nuveen Dow 30SM Dynamic Overwrite Fund Common Shares of Beneficial Interest,$14.17,0.07,0.496%,0.00,,2014,27770,Finance,Finance Companies
DIBS,1stdibs.com Inc. Common Stock,$2.51,0.01,0.40%,89566963.00,United States,2021,259918,Consumer Discretionary,Catalog/Specialty Distribution
DIN,Dine Brands Global Inc. Common Stock,$24.06,-0.36,-1.474%,375956243.00,United States,,337561,Consumer Discretionary,Restaurants
DIST,Distoken Acquisition Corporation Ordinary Shares,$12.00,0.00,0.00%,0.00,China,2023,141,Finance,Blank Checks
DISTR,Distoken Acquisition Corporation Right,$0.27,0.02,8.00%,0.00,China,2023,1669,Finance,Blank Checks
DISTW,Distoken Acquisition Corporation Warrant,$0.09,0.00,0.00%,0.00,China,2023,1684,Finance,Blank Checks
DIT,AMCON Distributing Company Common Stock,$112.82,0.00,0.00%,72821023.00,United States,1999,11,Consumer Discretionary,Food Distributors
DJCO,Daily Journal Corp. (S.C.) Common Stock,$421.43,-4.59,-1.077%,580488639.00,United States,,66439,Consumer Discretionary,Newspapers/Magazines
DK,Delek US Holdings Inc. Common Stock,$19.25,-0.56,-2.827%,1169000333.00,United States,2017,1917403,Energy,Integrated oil Companies
DLHC,DLH Holdings Corp.,$5.00,-0.07,-1.381%,71932340.00,United States,,46811,Consumer Discretionary,Professional Services
DLNG,Dynagas LNG Partners LP Common Units,$3.68,-0.07,-1.867%,134974238.00,Greece,,54729,Consumer Discretionary,Marine Transportation
DLPN,Dolphin Entertainment Inc. Common Stock,$1.07,0.00,0.00%,11949887.00,United States,,13343,Consumer Discretionary,Other Consumer Services
DLTH,Duluth Holdings Inc. Class B Common Stock,$1.86,-0.02,-1.064%,65357699.00,United States,2015,24084,Consumer Discretionary,Clothing/Shoe/Accessory Stores
DLX,Deluxe Corporation Common Stock,$14.27,-0.05,-0.349%,638437517.00,United States,,451960,Consumer Discretionary,Publishing
DLY,DoubleLine Yield Opportunities Fund Common Shares of Beneficial Interest,$15.70,0.04,0.255%,752748730.00,United States,2020,116037,Finance,Investment Managers
DMA,Destra Multi-Alternative Fund Common Stock,$8.78,-0.06,-0.679%,0.00,,2022,44687,Finance,Trusts Except Educational Religious and Charitable
DMAA,Drugs Made In America Acquisition Corp. Ordinary Shares,$10.13,-0.005,-0.049%,0.00,United States,2025,7166,,
DMAAU,Drugs Made In America Acquisition Corp. Units,$10.30,0.00,0.00%,0.00,United States,2025,181,,
DMAC,DiaMedica Therapeutics Inc. Common Stock,$4.11,-0.08,-1.909%,176251041.00,United States,2018,89854,Health Care,Biotechnology: Pharmaceutical Preparations
DMB,BNY Mellon Municipal Bond Infrastructure Fund Inc. Common Stock,$10.04,-0.01,-0.10%,0.00,,2013,69267,Finance,Trusts Except Educational Religious and Charitable
DMF,BNY Mellon Municipal Income Inc. Common Stock,$6.97,0.00,0.00%,434167252.00,United States,1988,29172,Finance,Finance/Investors Services
DMLP,Dorchester Minerals L.P. Common Units Representing Limited Partnership Interests,$26.77,-0.69,-2.513%,1267285268.00,United States,,651846,Energy,Oil & Gas Production
DMO,Western Asset Mortgage Opportunity Fund Inc. Common Stock,$11.68,0.02,0.172%,0.00,United States,2010,26879,Finance,Trusts Except Educational Religious and Charitable
DMRC,Digimarc Corporation Common Stock,$13.08,-0.01,-0.076%,281900173.00,United States,,584293,Technology,EDP Services
DMYY,dMY Squared Technology Group Inc. Class A Common Stock,$14.35,0.34,2.427%,0.00,,2022,64249,Finance,Blank Checks
DNA,Ginkgo Bioworks Holdings Inc. Class A Common Stock,$6.95,-0.30,-4.138%,406796545.00,United States,2021,769651,Health Care,Biotechnology: Biological Products (No Diagnostic Substances)
DNLI,Denali Therapeutics Inc. Common Stock,$13.24,-0.30,-2.216%,1923458199.00,United States,2017,1205593,Health Care,Biotechnology: Biological Products (No Diagnostic Substances)
DNN,Denison Mines Corp Ordinary Shares (Canada),$1.59,-0.01,-0.625%,1424233121.00,Canada,,191221162,Basic Materials,Other Metals and Minerals
DNOW,DNOW Inc. Common Stock,$14.42,-0.15,-1.03%,1522293011.00,United States,2014,622308,Industrials,Metal Fabrications
DNP,DNP Select Income Fund Inc. Common Stock,$9.80,0.00,0.00%,0.00,United States,1987,527125,Finance,Investment Managers
DNTH,Dianthus Therapeutics Inc. Common Stock,$17.39,-0.46,-2.577%,559262087.00,United States,2018,238844,Health Care,Biotechnology: Pharmaceutical Preparations
DNUT,Krispy Kreme Inc. Common Stock,$2.89,-0.04,-1.365%,493612000.00,United States,2021,2085164,Consumer Staples,Food Chains
DOGZ,Dogness (International) Corporation Class A Common Stock,$25.74,1.12,4.549%,327687137.00,China,2017,169242,Consumer Discretionary,Miscellaneous manufacturing industries
DOLE,Dole plc Ordinary Shares,$14.16,0.06,0.426%,1347154561.00,Ireland,2021,553159,Consumer Staples,Farming/Seeds/Milling
DOMH,Dominari Holdings Inc. Common Stock,$4.42,-0.17,-3.704%,64991879.00,United States,,223018,Health Care,Biotechnology: Pharmaceutical Preparations
DOMO,Domo Inc. Class B Common Stock,$12.70,0.08,0.634%,507232742.00,United States,2018,912291,Technology,Computer Software: Prepackaged Software
DOUG,Douglas Elliman Inc. Common Stock,$2.72,-0.20,-6.849%,241366919.00,United States,2021,964307,Finance,Real Estate
DOYU,DouYu International Holdings Limited ADS,$6.56,-0.17,-2.526%,197973315.00,China,2019,43666,Technology,Computer Software: Programming Data Processing
DPG,Duff & Phelps Utility and Infrastructure Fund Inc.,$12.26,0.06,0.492%,0.00,United States,2011,71757,Finance,Trusts Except Educational Religious and Charitable
DPRO,Draganfly Inc. Common Shares,$1.77,-0.01,-0.562%,7483197.00,Canada,,61567,Industrials,Aerospace
DQ,DAQO New Energy Corp. American Depositary Shares each representing five ordinary shares,$13.36,-0.46,-3.329%,895877712.00,China,2010,625071,Technology,Semiconductors
DRCT,Direct Digital Holdings Inc. Class A Common Stock,$0.5226,-0.0154,-2.862%,9883139.00,United States,2022,186274,Consumer Discretionary,Advertising
DRD,DRDGOLD Limited American Depositary Shares,$15.01,-0.10,-0.662%,1297747654.00,South Africa,,232652,Basic Materials,Precious Metals
DRDB,Roman DBDR Acquisition Corp. II Ordinary shares,$10.27,0.02,0.195%,0.00,United States,2025,182351,,
DRDBU,Roman DBDR Acquisition Corp. II Unit,$10.4899,0.00,0.00%,0.00,United States,2024,2,,
DRDBW,Roman DBDR Acquisition Corp. II Warrants,$0.4102,-0.038,-8.478%,0.00,United States,2025,2556,,
DRH,Diamondrock Hospitality Company Common Stock,$7.64,-0.03,-0.391%,1576217919.00,United States,2005,3427716,Real Estate,Real Estate Investment Trusts
DRIO,DarioHealth Corp. Common Stock,$0.7151,0.0151,2.157%,31428233.00,Israel,,105886,Health Care,Medical/Dental Instruments
DRMA,Dermata Therapeutics Inc. Common Stock,$0.7201,-0.0119,-1.626%,4592883.00,United States,2021,41909,Health Care,Biotechnology: Pharmaceutical Preparations
DRMAW,Dermata Therapeutics Inc. Warrant,$0.0145,0.0008,5.839%,92483.00,United States,2021,4040,Health Care,Biotechnology: Pharmaceutical Preparations
DRRX,DURECT Corporation Common Stock,$0.5313,-0.0135,-2.478%,16492923.00,United States,2000,40899,Health Care,Biotechnology: Pharmaceutical Preparations
DRTS,Alpha Tau Medical Ltd. Ordinary Shares,$2.985,-0.015,-0.50%,210086001.00,Israel,,5072,Health Care,Medical/Dental Instruments
DRTSW,Alpha Tau Medical Ltd. Warrant,$0.21,-0.04,-16.00%,14779920.00,Israel,,240,Health Care,Medical/Dental Instruments
DRUG,Bright Minds Biosciences Inc. Common Stock,$25.95,-1.40,-5.119%,181364265.00,Canada,,26263,Health Care,Biotechnology: Pharmaceutical Preparations
DSGN,Design Therapeutics Inc. Common Stock,$3.73,-0.28,-6.983%,211747169.00,United States,2021,69291,Health Care,Biotechnology: Pharmaceutical Preparations
DSGR,Distribution Solutions Group Inc. Common Stock,$27.25,-0.68,-2.435%,1265444792.00,United States,,63347,Consumer Discretionary,Industrial Specialties
DSL,DoubleLine Income Solutions Fund Common Shares of Beneficial Interests,$12.30,0.06,0.49%,1254560984.00,United States,2013,413622,Finance,Trusts Except Educational Religious and Charitable
DSM,BNY Mellon Strategic Municipal Bond Fund Inc. Common Stock,$5.55,-0.03,-0.538%,0.00,United States,1989,222845,Finance,Investment Managers
DSP,Viant Technology Inc. Class A Common Stock,$13.79,-0.17,-1.218%,862793193.00,United States,2021,139683,Technology,Computer Software: Programming Data Processing
DSS,DSS Inc. Common Stock,$0.90,-0.0001,-0.011%,8183266.00,United States,,800,Consumer Discretionary,Containers/Packaging
DSU,Blackrock Debt Strategies Fund Inc. Common Stock,$10.47,-0.03,-0.286%,0.00,United States,1998,177349,Finance,Finance Companies
DSWL,Deswell Industries Inc. Common Shares,$2.30,-0.11,-4.564%,36651050.00,Macau,1995,51862,Industrials,Plastic Products
DSX,Diana Shipping inc. common stock,$1.52,0.07,4.828%,175967149.00,Greece,2005,623115,Consumer Discretionary,Marine Transportation
DSY,Big Tree Cloud Holdings Limited Ordinary Shares,$1.25,0.003,0.241%,71350683.00,China,,2784,Consumer Discretionary,Containers/Packaging
DSYWW,Big Tree Cloud Holdings Limited Warrants,$0.0145,0.00,0.00%,827668.00,China,,20674,Consumer Discretionary,Containers/Packaging
DTCK,Davis Commodities Limited Ordinary Shares,$0.56,0.01,1.818%,13720350.00,Singapore,2023,13486,Industrials,Farming/Seeds/Milling
DTF,DTF Tax-Free Income 2028 Term Fund Inc. Common Stock,$11.20,0.03,0.269%,78731150.00,United States,1991,8842,Finance,Investment Managers
DTI,Drilling Tools International Corporation Common Stock,$2.62,-0.04,-1.504%,93252971.00,United States,2021,32382,Industrials,Metal Fabrications
DTIL,Precision BioSciences Inc. Common Stock,$4.83,-0.09,-1.829%,53556170.00,United States,2019,27941,Health Care,Biotechnology: Biological Products (No Diagnostic Substances)
DTSQ,DT Cloud Star Acquisition Corporation Ordinary Shares,$10.32,0.00,0.00%,0.00,United States,2024,1,,
DTSQR,DT Cloud Star Acquisition Corporation Right,$0.1342,-0.0058,-4.143%,0.00,United States,2024,300,,
DTSS,Datasea Inc. Common Stock,$2.27,-0.13,-5.417%,17374287.00,China,,59139,Technology,Computer Software: Prepackaged Software
DTST,Data Storage Corporation Common Stock,$3.75,-0.13,-3.351%,26774599.00,United States,,16209,Technology,EDP Services
DTSTW,Data Storage Corporation Warrant,$0.26,-0.01,-3.704%,1856372.00,United States,,3619,Technology,EDP Services
DUO,Fangdd Network Group Ltd. Class A Ordinary Shares,$0.2023,-0.0101,-4.755%,9923142.00,China,2019,2725719,Finance,Real Estate
DUOT,Duos Technologies Group Inc. Common Stock,$7.65,-0.725,-8.657%,89152373.00,United States,,136777,Technology,Computer Software: Prepackaged Software
DVAX,Dynavax Technologies Corporation Common Stock,$9.79,0.03,0.307%,1175589564.00,United States,2004,1937331,Health Care,Biotechnology: Pharmaceutical Preparations
DVLT,Datavault AI Inc. Common Stock,$0.8237,-0.0168,-1.999%,54384125.00,United States,2018,407473,Technology,Semiconductors
DVS,Dolly Varden Silver Corporation Common Shares,$2.93,0.0002,0.007%,232991745.00,,2025,191312,,
DWSN,Dawson Geophysical Company Common Stock,$1.33,0.03,2.308%,41208935.00,United States,,544,Energy,Oil & Gas Production
DWTX,Dogwood Therapeutics Inc. Common Stock,$5.18,-0.11,-2.079%,9899643.00,United States,2020,35019,Health Care,Biotechnology: Pharmaceutical Preparations
DX,Dynex Capital Inc. Common Stock,$12.04,-0.07,-0.578%,1268190538.00,United States,,4055142,Real Estate,Real Estate Investment Trusts
DXF,Eason Technology Limited American Depositary Shares (each representing sixty-thousand (60000) Ordinary Shares),$6.177,-0.423,-6.409%,1540939.00,,,79622,Finance,Finance: Consumer Services
DXLG,Destination XL Group Inc. Common Stock,$1.13,-0.17,-13.077%,60483096.00,United States,,134641,Consumer Discretionary,Clothing/Shoe/Accessory Stores
DXPE,DXP Enterprises Inc. Common Stock,$82.68,-0.32,-0.386%,1297603897.00,United States,,72988,Industrials,Industrial Machinery/Components
DXR,Daxor Corporation Common Stock,$8.0965,-0.0374,-0.46%,39187060.00,United States,,2768,Health Care,Medical/Dental Instruments
DXST,Decent Holding Inc Class A Ordinary Shares,$1.34,-0.0786,-5.541%,21775000.00,China,2025,26862,Industrials,Miscellaneous
DXYZ,Destiny Tech100 Inc. Common Stock,$42.46,-0.15,-0.352%,0.00,,2024,527314,,
DYAI,Dyadic International Inc. Common Stock,$1.037,0.002,0.193%,31204015.00,United States,,13558,Health Care,Biotechnology: Biological Products (No Diagnostic Substances)
DYCQ,DT Cloud Acquisition Corporation Ordinary Shares,$10.67,0.00,0.00%,0.00,United Kingdom,2024,33,,
DYN,Dyne Therapeutics Inc. Common Stock,$11.96,-0.28,-2.288%,1359452273.00,United States,2020,1132995,Health Care,Biotechnology: Pharmaceutical Preparations
DYNX,Dynamix Corporation Class A Ordinary Shares,$10.05,0.00,0.00%,0.00,United States,2024,117,,
DYNXU,Dynamix Corporation Unit,$10.19,-0.02,-0.196%,0.00,United States,2024,140,,
DYNXW,Dynamix Corporation Warrant,$0.348,-0.052,-13.00%,0.00,United States,2024,311,,
EAD,Allspring Income Opportunities Fund Common Shares,$6.84,0.02,0.293%,0.00,United States,2003,147717,Finance,Finance/Investors Services
EAF,GrafTech International Ltd. Common Stock,$0.9962,-0.0438,-4.212%,257132128.00,United States,2018,2245932,Energy,Industrial Machinery/Components
EARN,Ellington Credit Company Common Shares of Beneficial Interest,$5.62,-0.11,-1.92%,211082676.00,United States,2013,336710,Real Estate,Real Estate Investment Trusts
EB,Eventbrite Inc. Class A Common Stock,$2.36,-0.02,-0.84%,226298333.00,United States,2018,525691,Technology,Computer Software: Programming Data Processing
EBF,Ennis Inc. Common Stock,$18.67,-0.05,-0.267%,486413636.00,United States,,136620,Consumer Discretionary,Office Equipment/Supplies/Services
EBMT,Eagle Bancorp Montana Inc. Common Stock,$16.97,-0.03,-0.176%,134948444.00,United States,2010,15227,Finance,Major Banks
EBON,Ebang International Holdings Inc. Class A Ordinary Shares,$3.6177,0.0042,0.116%,23674005.00,China,2020,2722,Technology,Semiconductors
EBS,Emergent BioSolutions Inc. Common Stock,$6.32,-0.14,-2.167%,343035867.00,United States,2006,901777,Health Care,Biotechnology: Pharmaceutical Preparations
EBTC,Enterprise Bancorp Inc Common Stock,$38.55,-0.37,-0.951%,482198280.00,United States,,32550,Finance,Major Banks
ECAT,BlackRock ESG Capital Allocation Term Trust Common Shares of Beneficial Interest,$15.83,0.07,0.444%,1711777050.00,United States,2021,344957,Finance,Trusts Except Educational Religious and Charitable
ECBK,ECB Bancorp Inc. Common Stock,$16.25,-0.20,-1.216%,146699816.00,United States,2022,12197,Finance,Banks
ECC           ,Eagle Point Credit Company Inc. Common Stock,$7.88,0.18,2.338%,478020689.00,United States,2014,1327334,Finance,Trusts Except Educational Religious and Charitable
ECCC,Eagle Point Credit Company Inc. 6.50% Series C Term Preferred Stock due 2031,$22.4695,0.0395,0.176%,1363056583.00,United States,,3986,Finance,Trusts Except Educational Religious and Charitable
ECCU,Eagle Point Credit Company Inc. 7.75% Notes due 2030,$24.80,-0.04,-0.161%,0.00,United States,2024,6550,,
ECCV,Eagle Point Credit Company Inc. 5.375% Notes due 2029,$23.0365,0.0465,0.202%,1397452234.00,United States,2022,3244,Finance,Trusts Except Educational Religious and Charitable
ECCW,Eagle Point Credit Company Inc. 6.75% Notes due 2031,$23.48,0.06,0.256%,1424356064.00,United States,2021,2534,Finance,Trusts Except Educational Religious and Charitable
ECCX,Eagle Point Credit Company Inc. 6.6875% Notes due 2028,$24.6901,-0.1999,-0.803%,1497763784.00,United States,2022,868,Finance,Trusts Except Educational Religious and Charitable
ECDA,ECD Automotive Design Inc. Common Stock,$0.3404,0.0757,28.598%,12045279.00,United States,2022,101814543,Consumer Discretionary,Auto Manufacturing
ECDAW,ECD Automotive Design Inc. Warrant ,$0.0204,0.00,0.00%,721868.00,United States,2022,2500,Consumer Discretionary,Auto Manufacturing
ECF,Ellsworth Growth and Income Fund Ltd.,$9.78,-0.07,-0.711%,0.00,United States,1986,10936,Finance,Finance/Investors Services
ECO,Okeanis Eco Tankers Corp. Common Stock,$23.33,0.33,1.435%,751088540.00,,,102636,Consumer Discretionary,Marine Transportation
ECOR,electroCore Inc. Common Stock,$5.00,0.10,2.041%,37103090.00,United States,2018,68392,Health Care,Biotechnology: Electromedical & Electrotherapeutic Apparatus
ECPG,Encore Capital Group Inc Common Stock,$37.90,-0.43,-1.122%,884934680.00,United States,,268331,Finance,Finance Companies
ECVT,Ecovyst Inc. Common Stock,$7.45,-0.06,-0.799%,874633800.00,United States,2017,1108023,Industrials,Major Chemicals
ECX,ECARX Holdings Inc. Class A Ordinary shares,$1.56,-0.02,-1.266%,539338841.00,China,,1125036,Technology,EDP Services
EDAP,EDAP TMS S.A. American Depositary Shares,$1.78,-0.01,-0.559%,66557913.00,France,1997,17342,Health Care,Biotechnology: Electromedical & Electrotherapeutic Apparatus
EDBL,Edible Garden AG Incorporated Common Stock,$3.47,-0.18,-4.932%,5743766.00,United States,2022,282001,Consumer Staples,Farming/Seeds/Milling
EDBLW,Edible Garden AG Incorporated Warrant,$0.1378,-0.0071,-4.90%,228095.00,United States,2022,37457,Consumer Staples,Farming/Seeds/Milling
EDD,Morgan Stanley Emerging Markets Domestic Debt Fund Inc. Common Stock,$4.94,-0.01,-0.202%,0.00,United States,2007,288384,Finance,Finance Companies
EDF,Virtus Stone Harbor Emerging Markets Income Fund Common Shares of Beneficial Interest,$4.94,-0.01,-0.202%,0.00,United States,2010,97883,Finance,Investment Managers
EDHL,Everbright Digital Holding Limited Ordinary Shares,$4.39,-0.01,-0.227%,116335000.00,Hong Kong,2025,7252,Consumer Discretionary,Advertising
EDIT,Editas Medicine Inc. Common Stock,$1.72,-0.11,-6.011%,143986117.00,United States,2016,1274286,Health Care,Biotechnology: Biological Products (No Diagnostic Substances)
EDN,Empresa Distribuidora Y Comercializadora Norte S.A. (Edenor) American Depositary Shares,$33.04,-0.63,-1.871%,1497463825.00,Argentina,2007,222069,Utilities,Electric Utilities: Central
EDRY,EuroDry Ltd. Common Shares ,$8.13,0.1471,1.843%,22981047.00,Greece,,1369,Consumer Discretionary,Marine Transportation
EDSA,Edesa Biotech Inc. Common Shares,$1.96,-0.03,-1.508%,6364882.00,United States,,350665,Health Care,Biotechnology: Pharmaceutical Preparations
EDTK,Skillful Craftsman Education Technology Limited Ordinary Share,$0.9278,0.0378,4.247%,14779345.00,China,2020,1468,Real Estate,Other Consumer Services
EDUC,Educational Development Corporation Common Stock,$1.36,-0.04,-2.857%,11673153.00,United States,,2228,Consumer Discretionary,Consumer Specialties
EEA,The European Equity Fund Inc. Common Stock,$9.88,-0.04,-0.403%,0.00,United States,,23826,Finance,Trusts Except Educational Religious and Charitable
EEIQ,EpicQuest Education Group International Limited Common Stock,$0.596,-0.027,-4.334%,7925711.00,United States,2021,4418,Real Estate,Other Consumer Services
EEX,Emerald Holding Inc. Common Stock,$4.58,-0.04,-0.866%,910773528.00,United States,2017,612387,Consumer Discretionary,Business Services
EFC,Ellington Financial Inc. Common Stock ,$12.57,-0.26,-2.027%,1188030132.00,United States,2010,1065311,Finance,Real Estate
EFOI,Energy Focus Inc. Common Stock,$2.05,0.11,5.67%,10996954.00,United States,,23060,Consumer Discretionary,Building Products
EFR,Eaton Vance Senior Floating-Rate Fund Common Shares of Beneficial Interest,$11.97,0.07,0.588%,0.00,United States,2003,144066,Finance,Trusts Except Educational Religious and Charitable
EFSC,Enterprise Financial Services Corporation Common Stock,$52.94,-0.29,-0.545%,1955216079.00,United States,,198777,Finance,Major Banks
EFSCP,Enterprise Financial Services Corporation Depositary Shares Each Representing a 1/40th Interest in a Share of 5% Fixed Rate Non-Cumulative Perpetual Preferred Stock Series A,$19.4512,0.3629,1.901%,718384945.00,United States,,2078,Finance,Major Banks
EFSI,Eagle Financial Services Inc Common Stock,$31.49,-0.25,-0.788%,169364619.00,United States,,12443,Finance,Major Banks
EFT,Eaton Vance Floating Rate Income Trust Common Shares of Beneficial Interest,$12.27,0.04,0.327%,356939392.00,United States,2004,86234,Finance,Finance Companies
EFXT,Enerflex Ltd Common Shares,$7.03,-0.15,-2.089%,872035021.00,Canada,2022,148780,Industrials,Industrial Machinery/Components
